Indicator,MoA Type ,MoA,Drug,Title,URL,Author,PMID,Abstract,Date
Narcolepsy,Inhibitor,The mechanism of action of methamphetamine is not specified in the abstract. No specific receptor subtypes are mentioned either.,methamphetamine,Treatment of narcolepsy with methamphetamine.,https://pubmed.ncbi.nlm.nih.gov/8341891/,"Mitler MM, Hajdukovic R, Erman MK.",8341891,"Eight pairs of subjects (each consisting of a narcoleptic and a control matched on the basis of age, sex, educational background and job) were evaluated under the following double-blind, randomized treatment conditions: baseline, placebo, low dose and high dose methamphetamine. Subjects were drug-free for 2 weeks prior to beginning the protocol. Methamphetamine was the only drug taken during the protocol and was given in a single morning dose of 0, 20 or 40-60 mg to narcoleptics and 0, 5 or 10 mg to controls. The protocol was 28 days long, with each of the four treatment conditions lasting 4 days followed by 3 days of washout. Nighttime polysomnography and daytime testing were done during the last 24 hours of each treatment condition. Daytime sleep tendency was assessed with the multiple sleep latency test (MSLT). Daytime performance was assessed with performance tests including a simple, computer-based driving task. Narcoleptics' mean MSLT sleep latency increased from 4.3 minutes on placebo to 9.3 minutes on high dose, compared with an increase from 10.4 to 17.1 minutes for controls. Narcoleptics' error rate on the driving task decreased from 2.53% on placebo to 0.33% on high dose, compared with a decrease from 0.22% to 0.16% for controls. The effects of methamphetamine on nocturnal sleep were generally dose-dependent and affected sleep continuity and rapid eye movement (REM) sleep. Elimination half life was estimated to be between 15.9 and 22.0 hours. Mild side effects emerged in a dose-dependent fashion and most often involved the central nervous system and gastrointestinal tract. We concluded that methamphetamine caused a dose-dependent decrease in daytime sleep tendency and improvement in performance in both narcoleptics and controls. Methamphetamine at doses of 40-60 mg allowed narcoleptics to function at levels comparable to those of unmedicated controls.Adult Brain / drug effects Cross-Sectional Studies Delusions / chemically induced Double-Blind Method Female Heart Rate / drug effects Humans Hypertension / chemically induced Male Methamphetamine / adverse effects Methamphetamine / pharmacology Methamphetamine / therapeutic use* Narcolepsy / diagnosis Narcolepsy / drug therapy* Polysomnography Sleep, REM / drug effects Task Performance and Analysis",1993 Jun
Narcolepsy,Inhibitor,The mechanism of action of the drug being evaluated in this article is sodium oxybate. It targets disrupted nighttime sleep in patients with narcolepsy. There is no mention of receptor subtype(s) being evaluated in this article.,sodium oxybate,"Effect of FT218, a Once-Nightly Sodium Oxybate Formulation, on Disrupted Nighttime Sleep in Patients with Narcolepsy: Results from the Randomized Phase III REST-ON Trial.",https://pubmed.ncbi.nlm.nih.gov/35380374/,"Roth T, Dauvilliers Y, Thorpy MJ, Kushida C, Corser BC, Bogan R, Rosenberg R, Dubow J, Seiden D.",35380374,"Sodium oxybate has been recognized as a gold standard for the treatment of disrupted nighttime sleep due to narcolepsy. Its short half-life and immediate-release formulation require patients to awaken 2.5-4 h after their bedtime dose to take a second dose. A novel extended-release, once-nightly sodium oxybate formulation (ON-SXB; FT218) is under US Food and Drug Administration review for the treatment of adults with narcolepsy.
A phase III trial of ON-SXB in individuals with narcolepsy type 1 (NT1) or 2 (NT2) [the REST-ON trial; NCT02720744] has been conducted and the primary results reported elsewhere. Secondary objectives from REST-ON were to assess the efficacy of ON-SXB on disrupted nighttime sleep; the results of this analysis are reported here.
In the double-blind, phase III REST-ON trial, patients aged ≥ 16 years were randomly assigned 1:1 to ON-SXB (1 week, 4.5 g; 2 weeks, 6 g; 5 weeks, 7.5 g; 5 weeks, 9 g) or placebo. Secondary endpoints included polysomnographic measures of sleep stage shifts and nocturnal arousals and patient-reported assessments of sleep quality and refreshing nature of sleep at 6, 7.5, and 9 g; post hoc analyses included changes in time spent in each sleep stage, delta power, and assessments in stimulant-use subgroups for prespecified endpoints.
In total, 190 participants (n = 97, ON-SXB; n = 93, placebo) were included in the efficacy analyses. All three ON-SXB doses demonstrated a clinically meaningful, statistically significant decrease vs placebo in the number of transitions to wake/N1 from N1, N2, and rapid eye movement (REM) stages (all doses p < 0.001) and the number of nocturnal arousals (p < 0.05 ON-SXB 6 g; p < 0.001 7.5 and 9 g). Sleep quality and refreshing nature of sleep were significantly improved with all three ON-SXB doses vs placebo (p < 0.001). Post hoc analyses revealed a significant reduction in time spent in N1 (p < 0.05 ON-SXB 6 g; p < 0.001 7.5 and 9 g) and REM (all p < 0.001) and increased time spent in N3 with ON-SXB vs placebo (all p < 0.001), with a significant increase in delta power (p < 0.01 ON-SXB 6 g; p < 0.05 7.5 g; p < 0.001 9 g) and increased REM latency (ON-SXB 7.5 g vs placebo; p < 0.05). Significant improvements in disrupted nighttime sleep were observed regardless of concomitant stimulant use.
The clinically beneficial, single nighttime dose of ON-SXB significantly improved disrupted nighttime sleep in patients with narcolepsy.
ClinicalTrials.gov NCT02720744.Adult Humans Narcolepsy* / drug therapy Polysomnography Sleep Sleep Stages Sodium Oxybate* / adverse effects",2022 Apr
Narcolepsy,Inhibitor,The mechanism of action for the drugs in this article is to act as central nervous system stimulants. The article does not provide information on the specific receptor subtype(s) and target of the chemical reaction for these drugs.,"amphetamine, mazindol, and fencamfamin","Amphetamine, mazindol, and fencamfamin in narcolepsy.",https://pubmed.ncbi.nlm.nih.gov/2859077/,"Shindler J, Schachter M, Brincat S, Parkes JD.",2859077,"Twenty patients with the narcoleptic syndrome were treated separately with dexamphetamine sulphate tablets 10 and 30 mg, Dexedrine Spansules 10 mg, mazindol 4 mg, and fencamfamin hydrochloride 60 mg daily. Each drug was given for four weeks and the effects compared. In these dosages the reported frequency of attacks of narcolepsy was roughly halved with each treatment, dexamphetamine 30 mg daily being only slightly more potent than 10 mg. The subjective effects of Dexedrine tablets and Spansules could not be distinguished by most patients. Effects on mood, alertness, and sympathomimetic side effects were largely inseparable with all these drugs, but a decrease in appetite was not reported by patients with narcolepsy.Adult Aged Amphetamines / adverse effects Amphetamines / therapeutic use* Central Nervous System Stimulants / adverse effects Central Nervous System Stimulants / therapeutic use* Female Humans Indoles / therapeutic use* Male Mazindol / adverse effects Mazindol / therapeutic use* Middle Aged Narcolepsy / drug therapy* Norbornanes / adverse effects Norbornanes / therapeutic use*",1985 Apr 20
Narcolepsy,Inhibitor,"The drug being evaluated in this study is modafinil, which is a central nervous system stimulant. The mechanism of action of modafinil is not specified in this article, but it is known to increase wakefulness and alertness by affecting neurotransmitters such as dopamine, norepinephrine, and orexin. It does not bind to any specific receptors.",modafinil,"The effect of modafinil on cortical excitability in patients with narcolepsy: a randomized, placebo-controlled, crossover study.",https://pubmed.ncbi.nlm.nih.gov/20810312/,"Joo EY, Hong SB, Kim HJ, Lim YH, Koo DL, Ji KH, Tae WS.",20810312,"To investigate the effect of modafinil on cortical excitability in patients with narcolepsy using transcranial magnetic stimulation (TMS).
Nineteen drug-naïve narcolepsy patients with cataplexy (10 males, 9 females, and mean age 28.5 years) and 25 age- and sex-matched healthy controls were recruited. In this double-blind, randomized, crossover study, patients and controls received a single dose of 400mg modafinil or placebo. Modafinil and placebo administrations were separated by a 2-week washout period. TMS parameters, such as resting motor thresholds (RMT), motor-evoked potential (MEP) amplitudes, cortical silent periods (CSP), short-interval intracortical inhibition (SICI), and intracortical facilitation (ICF), were measured before and 3h after administering modafinil or placebo. The differences of TMS parameters were statistically tested between patients and controls and between before and after modafinil or placebo administration.
Narcolepsy patients had significantly increased CSP durations compared to controls (independent t-test, P<0.05), indicating decreased excitability of cortical networks in human narcolepsy. In patients after modafinil administration, MEP amplitudes, SICI, and ICF increased, and CSP duration shortened significantly, meaning enhanced motor excitability, whereas in controls modafinil did not change TMS parameters significantly. Placebo administration did not affect TMS parameters both in patients or controls.
Narcolepsy patients with cataplexy showed decreased cortical excitability than normal healthy controls. Single dose modafinil significantly increased motor excitability in narcolepsy patients but had no effect in healthy controls.Adult Benzhydryl Compounds / pharmacology Benzhydryl Compounds / therapeutic use* Case-Control Studies Central Nervous System Stimulants / pharmacology Central Nervous System Stimulants / therapeutic use* Cross-Over Studies Double-Blind Method Electromyography Evoked Potentials, Motor / drug effects Evoked Potentials, Motor / physiology Female Humans Male Middle Aged Modafinil Motor Cortex / drug effects* Motor Cortex / physiopathology Narcolepsy / drug therapy* Narcolepsy / physiopathology Transcranial Magnetic Stimulation Young Adult",2010 Oct
Narcolepsy,Inhibitor,The drug being evaluated in the article is modafinil. The article does not provide information on the mechanism of action or receptor subtype targeted by modafinil.,modafinil,"Maintenance of Wakefulness Test, real and simulated driving in patients with narcolepsy/hypersomnia.",https://pubmed.ncbi.nlm.nih.gov/30735912/,"Sagaspe P, Micoulaud-Franchi JA, Coste O, LÃ©ger D, EspiÃ© S, Davenne D, Lopez R, Dauvilliers Y, Philip P.",30735912,"To assess the relationship between real and simulated driving performance and the objective level of alertness as measured by the Maintenance of Wakefulness Test (MWT) in patients suffering from narcolepsy or idiopathic hypersomnia.
Twenty-seven patients (10 patients with narcolepsy, type 1 (n = 7) and type 2 (n = 3), and 17 patients with idiopathic hypersomnia, mean age = 33.8 ± 11.1 years, range = 18-65 y; four males) were recruited in a randomized, crossover, double-blind placebo-controlled trial, and compared to 27 matched healthy controls. Patients were randomly assigned to receive modafinil (400 mg) or placebo before the driving test (2 h of real and 2 h of simulated highway driving for each patient). Standard deviation of lateral position (SDLP) of the vehicle in real and simulated driving and mean sleep latency in a 4 × 40 min MWT were assessed.
Untreated patients presented shorter sleep latencies on the MWT (20.8 (IQ range 16.1-32.9) vs. 34.9 min (IQ range 28.1-40.0)) and worse simulated driving performance (P < 0.001) than treated patients. Nevertheless, treated patients still exhibited shorter mean sleep latencies on the MWT than controls (34.9 (IQ range 28.1-40.0) vs. 40 min (IQ range 37.1-40.0), P < 0.05), but driving performance was identical in both groups. The SDLP of the vehicle in real driving conditions and the MWT score correlated with the SDLP in simulated driving (respectively, r = 0.34, P < 0.05 and r = -0.56, P < 0.001).
In patients with narcolepsy/idiopathic hypersomnia, simulated driving and MWT explore different dimensions of fitness-to-drive and could be used complementarily to better evaluate sleep-related driving impairment.Adult Automobile Driving* / psychology Computer Simulation* Cross-Over Studies Double-Blind Method Humans Idiopathic Hypersomnia / diagnosis* Idiopathic Hypersomnia / drug therapy Idiopathic Hypersomnia / psychology Middle Aged Modafinil / pharmacology Modafinil / therapeutic use Narcolepsy / diagnosis* Narcolepsy / drug therapy Narcolepsy / psychology Wakefulness / drug effects Wakefulness / physiology* Wakefulness-Promoting Agents / pharmacology Wakefulness-Promoting Agents / therapeutic use Young Adult",2019 Mar
Narcolepsy,Inhibitor,"The drug being evaluated is caffeine, which is not a receptor subtype or a mechanism of action.",caffeine,The effects of caffeine on drowsiness in patients with narcolepsy: a double-blind randomized controlled pilot study.,https://pubmed.ncbi.nlm.nih.gov/32215834/,"Aldosari MS, Olaish AH, Nashwan SZ, Abulmeaty MMA, BaHammam AS.",32215834,"The effects of caffeine on drowsiness and reaction time in patients with narcolepsy are unclear. We aimed to assess the effects of caffeine as add-on therapy in narcolepsy patients.
A randomized, double-blind, placebo-control clinical pilot trial was conducted with a parallel, two-arm trial allocation ratio of 1:1. Participants attended two study visits 7 days apart. The drug was administered orally in a single opaque capsule containing 200 mg caffeine/placebo daily in the morning for 1 week. Sleepiness was assessed objectively using infrared reflectance oculography to measure the percentage of long eye closure (LEC%) and subjectively using two sleepiness scales, the Stanford Sleepiness Scale (SSS) and Karolinska Sleepiness Scale (KSS). Parameters were measured at baseline (BL) prior to taking the drug, after taking the first dose (FD), and after 1 week (WD) of daily caffeine.
Sixteen participants with narcolepsy were included. No significant differences between groups in baseline measurements were observed. LEC% was significantly decreased after the FD and WD compared with baseline levels (BL 1.4 ± 2.1 vs. FD 0.06 ± 0.0.6 and WD 0.03 ± 0.04). Significant improvements in alertness were observed using the KSS when comparing BL with FD and WD (6.3 ± 1.6, 4.9 ± 1.7, and 4.7 ± 1.7, respectively; p = 0.01). No changes in reaction time or SSS scores were noted.
Our findings suggest that a small dose of caffeine has positive effects on alertness in patients with narcolepsy. However, larger trials are required to confirm these findings.
ClinicalTrial.gov NCT02832336.Adult Caffeine / therapeutic use* Double-Blind Method Humans Male Narcolepsy / drug therapy* Pilot Projects Treatment Outcome Young Adult",2020 Dec
Narcolepsy,Inhibitor,The article does not provide information about the specific mechanisms of action or receptor subtypes of the drugs being evaluated (pitolisant and modafinil).,modafinil,"Comparing Treatment Effect Measurements in Narcolepsy: The Sustained Attention to Response Task, Epworth Sleepiness Scale and Maintenance of Wakefulness Test.",https://pubmed.ncbi.nlm.nih.gov/25902810/,"van der Heide A, van Schie MK, Lammers GJ, Dauvilliers Y, Arnulf I, Mayer G, Bassetti CL, Ding CL, Lehert P, van Dijk JG.",25902810,"To validate the Sustained Attention to Response Task (SART) as a treatment effect measure in narcolepsy, and to compare the SART with the Maintenance of Wakefulness Test (MWT) and the Epworth Sleepiness Scale (ESS).
Validation of treatment effect measurements within a randomized controlled trial (RCT).
Ninety-five patients with narcolepsy with or without cataplexy.
The RCT comprised a double-blind, parallel-group, multicenter trial comparing the effects of 8-w treatments with pitolisant (BF2.649), modafinil, or placebo (NCT01067222). MWT, ESS, and SART were administered at baseline and after an 8-w treatment period. The severity of excessive daytime sleepiness and cataplexy was also assessed using the Clinical Global Impression scale (CGI-C).
The SART, MWT, and ESS all had good reliability, obtained for the SART and MWT using two to three sessions in 1 day. The ability to distinguish responders from nonresponders, classified using the CGI-C score, was high for all measures, with a high performance for the SART (r = 0.61) and the ESS (r = 0.54).
The Sustained Attention to Response Task is a valid and easy-to-administer measure to assess treatment effects in narcolepsy, enhanced by combining it with the Epworth Sleepiness Scale.Adult Attention / drug effects* Benzhydryl Compounds / therapeutic use* Cataplexy / drug therapy Cataplexy / physiopathology Cataplexy / psychology Double-Blind Method Female Humans Male Modafinil Narcolepsy / drug therapy* Narcolepsy / physiopathology* Narcolepsy / psychology Piperidines / therapeutic use* Reproducibility of Results Sleep Stages / drug effects* Time Factors Treatment Outcome Wakefulness / drug effects*",2015 Jul 1
Narcolepsy,Inhibitor,"The article discusses the use of L-tyrosine as a treatment for narcolepsy, but it does not provide information on the specific mechanism of action or receptor subtype being targeted.",L-tyrosine,Treatment of narcolepsy with L-tyrosine: double-blind placebo-controlled trial.,https://pubmed.ncbi.nlm.nih.gov/2572797/,"Elwes RD, Crewes H, Chesterman LP, Summers B, Jenner P, Binnie CD, Parkes JD.",2572797,"A randomised, double-blind, placebo-controlled study of L-tyrosine was done in ten subjects with narcolepsy and cataplexy. Of twenty-eight visual analogue scales rating mood and arousal, the subjects' ratings in the tyrosine treatment (9 g daily) and placebo periods differed significantly for only three (less tired, less drowsy, more alert). Ratings of daytime drowsiness, cataplexy, sleep paralysis, night-time sleep, overall clinical response, and measurements of multiple sleep latency and tests of speed and attention did not differ significantly between tyrosine and placebo periods. Dietary supplementation with tyrosine 9 g daily for 4 weeks seems to have a mild stimulant action on the central nervous system but this effect is not clinically significant in the treatment of the narcoleptic syndrome.Adult Affect / drug effects Arousal / drug effects Behavior / drug effects Cataplexy / drug therapy Double-Blind Method Drug Evaluation Female Humans Male Middle Aged Narcolepsy / drug therapy* Random Allocation Sleep, REM / drug effects Tyrosine / administration & dosage Tyrosine / therapeutic use*",1989 Nov 4
Narcolepsy,Inhibitor,"The mechanism of action of the drug being evaluated in the article is not specified. However, the drug in question is sodium oxybate, which is a central nervous system depressant that is thought to increase the amount of deep sleep and improve sleep continuity in patients with narcolepsy. Therefore, it does not work through specific receptors or target a specific chemical reaction.",sodium oxybate,"The nightly use of sodium oxybate is associated with a reduction in nocturnal sleep disruption: a double-blind, placebo-controlled study in patients with narcolepsy.",https://pubmed.ncbi.nlm.nih.gov/21206549/,"Black J, Pardi D, Hornfeldt CS, Inhaber N.",21206549,"To further explore the effects of sodium oxybate (SXB) administration on nocturnal sleep in narcolepsy patients during a double-blind, placebo-controlled, parallel group study conducted with 228 adult patients with narcolepsy/cataplexy in the United States, Canada, and Europe.
Patients were withdrawn from antidepressants and sedative/hypnotics, and then randomized to receive 4.5, 6, or 9 g SXB or placebo nightly for 8 weeks. Patients receiving 6 and 9 g/night doses were titrated to their final dose in weekly 1.5 g increments, while patients receiving placebo were randomized to undergo a similar mock dose titration. The use of stimulant therapy continued unchanged. Changes in sleep architecture were measured using centrally scored nocturnal polysomnograms. Daily diaries were used to record changes in narcolepsy symptoms and adverse events.
Following 8 weeks of SXB treatment, study patients demonstrated significant dose-related increases in the duration of stage 3 and 4 sleep, reaching a median increase of 52.5 minutes in patients receiving 9 g nightly. Compared to placebo-treated patients, delta power was significantly increased in all dose groups. Stage 1 sleep and the frequency of nocturnal awakenings were each significantly decreased at the 6 and 9 g/night doses. The changes in nocturnal sleep coincided with significant decreases in the severity and frequency of narcolepsy symptoms.
The nightly administration of SXB to narcolepsy patients significantly impacts measures of slow wave sleep, wake after sleep onset, awakenings, total sleep time, and stage 1 sleep in a dose-related manner. The frequency and severity of narcolepsy symptoms decreased with treatment.Adjuvants, Anesthesia / administration & dosage* Adjuvants, Anesthesia / adverse effects Administration, Oral Adolescent Adult Aged Analysis of Variance Cataplexy / diagnosis Cataplexy / drug therapy Circadian Rhythm Dose-Response Relationship, Drug Double-Blind Method Drug Administration Schedule Female Follow-Up Studies Humans Male Middle Aged Narcolepsy / diagnosis* Narcolepsy / drug therapy* Polysomnography / methods Reference Values Severity of Illness Index Sodium Oxybate / administration & dosage* Sodium Oxybate / adverse effects Time Factors Treatment Outcome Young Adult",2010 Dec 15
Narcolepsy,Inhibitor,There is no mention of any drugs being evaluated in this article.,stimulant medications,A comparison of three different sleep schedules for reducing daytime sleepiness in narcolepsy.,https://pubmed.ncbi.nlm.nih.gov/11403522/,"Rogers AE, Aldrich MS, Lin X.",11403522,"To determine if the combination of scheduled sleep periods and stimulant medications were more effective than stimulant medications alone in controlling the excessive daytime sleepiness experienced by narcoleptic patients.
Twenty-nine treated narcoleptic subjects were randomly assigned to one of three treatment groups: 1) two 15-minute naps per day; 2) a regular schedule for nocturnal sleep; or 3) a combination of scheduled naps and regular bedtimes. Measures of symptom severity and unscheduled daytime were obtained at baseline and at the end of the two-week treatment period, using the Narcolepsy Symptom Status Questionnaire (NSSQ) and 24-hour ambulatory polysomnographic monitoring. No alterations were made in stimulant medications during the study period.
N/A.
N/A.
N/A.
The addition of two-15 minute naps did not alter either symptom severity or the duration of unscheduled daytime sleep. Regular times for nocturnal sleep reduced perceived symptom severity, but did not reduce the amount of unscheduled daytime sleep. Only the combination of scheduled naps and regular nocturnal sleep times, significantly reduced both symptom severity and the amount of unscheduled daytime sleep in treated narcoleptic subjects. The type of sleep schedule prescribed, however, was less important than the severity of the patients' pre-treatment daytime sleepiness. Subjects with severe daytime sleepiness benefited from the addition of scheduled sleep periods, while those who were only moderately sleepy or able to maintain alertness did not benefit from scheduled sleep periods.
Scheduled sleep periods are helpful for only those patients who remain profoundly sleepy despite stimulant medications and should not be prescribed for all patients with narcolepsy.Adult Circadian Rhythm / physiology* Disorders of Excessive Somnolence / complications Disorders of Excessive Somnolence / prevention & control* Female Humans Male Narcolepsy / complications Narcolepsy / prevention & control* Polysomnography Sleep / physiology* Surveys and Questionnaires",2001 Jun 15
