Indicator,MoA Type ,MoA,Drug,Title,URL,Author,PMID,Abstract,Date
Narcolepsy,Inhibitor,"The mechanism of action of the drug is not mentioned in the article, but its therapeutic use is as a central nervous system stimulant. Therefore, the receptor subtype(s) are not specified.",methylphenidate,Successful treatment of giggle incontinence with methylphenidate.,https://pubmed.ncbi.nlm.nih.gov/8683753/,"Sher PK, Reinberg Y.",8683753,"Giggle incontinence, the second most common type of childhood enuresis unrelated to disease, is notoriously difficult to treat. However, the association of laughter or emotion precipitated alteration of muscle tone is suggestive of a functional relationship to cataplexy, a part of the narcoleptic syndrome complex that may respond to stimulant medication.
Two boys and 5 girls (mean age 10.9 years) with giggle incontinence, a positive family history of giggle incontinence (4 patients) and no evidence of urological disease were treated with methylphenidate for 1 to 5 years.
All patients responded positively with complete cessation of enuresis to varying dose schedules of methylphenidate.
These results suggest that giggle incontinence is a centrally mediated and likely hereditary disorder that may share a common pathophysiological basis with the narcolepsy/cataplexy syndrome.Adolescent Adult Central Nervous System Stimulants / therapeutic use* Child Enuresis / drug therapy* Female Follow-Up Studies Humans Male Methylphenidate / therapeutic use* Remission Induction",1996 Aug
Narcolepsy,Inhibitor,"The mechanism of action of sodium oxybate is not specified in the article, but it is known to act on the GABA system in the brain. The receptor subtypes it targets are GABA-B receptors.",sodium oxybate,"A randomized, double blind, placebo-controlled multicenter trial comparing the effects of three doses of orally administered sodium oxybate with placebo for the treatment of narcolepsy.",https://pubmed.ncbi.nlm.nih.gov/11833860/,[No authors listed],11833860,"To evaluate and compare the efficacy and safety of three doses of sodium oxybate and placebo for the treatment of narcolepsy symptoms.
A multicenter, double blind, placebo-controlled trial.
N/A.
Study subjects were 136 narcolepsy patients with 3 to 249 (median 21) cataplexy attacks weekly.
Prior to baseline measures, subjects discontinued anticataplectic medications. Stable doses of stimulants were permitted. Subjects were randomized in blinded fashion to receive 3, 6, or 9 g doses of sodium oxybate or placebo taken in equally divided doses upon retiring to bed and 2.5-4 hours later for 4 weeks.
Disease symptoms and adverse events were recorded in daily diaries. The primary measure of efficacy was the change from baseline in weekly cataplexy attacks. Secondary measures included daytime sleepiness using the Epworth Sleepiness Scale (ESS), inadvertent daytime naps/sleep attacks and nighttime awakenings. Investigators assessed changes in disease severity using Clinical Global Impression of Change (CGI-c). Compared to placebo, weekly cataplexy attacks were decreased by sodium oxybate at the 6 g dose (p=0.0529) and significantly at the 9 g dose (p=0.0008). The ESS was reduced at all doses, becoming significant at the 9 g dose (p=0.0001). The CGI-c demonstrated a dose-related improvement, significant at the 9 g dose (p=0.0002). The frequency of inadvertent naps/sleep attacks and the nighttime awakenings showed similar dose-response trends, becoming significant at the 9 g dose (p=0.0122 and p=0.0035, respectively). Sodium oxybate was generally well-tolerated at all three doses. Nausea, headache, dizziness and enuresis were the most commonly reported adverse events.
Sodium oxybate significantly improved symptoms in patients with narcolepsy and was well tolerated.Adjuvants, Anesthesia / administration & dosage Adjuvants, Anesthesia / therapeutic use* Adult Double-Blind Method Female Humans Male Narcolepsy / drug therapy* Sleep, REM / physiology Sodium Oxybate / administration & dosage Sodium Oxybate / therapeutic use* Time Factors",2002 Feb 1
Narcolepsy,Inhibitor,"The drug being evaluated is modafinil. The article does not provide specific information about the mechanism of action or receptor subtype of modafinil. However, it states that modafinil is a neuroprotective agent that is used to treat narcolepsy and improves vigilance by inducing changes in brain activity.",modafinil,"EEG-tomographic studies with LORETA on vigilance differences between narcolepsy patients and controls and subsequent double-blind, placebo-controlled studies with modafinil.",https://pubmed.ncbi.nlm.nih.gov/15592731/,"Saletu M, Anderer P, Saletu-Zyhlarz GM, Mandl M, Arnold O, Zeitlhofer J, Saletu B.",15592731,"The aim of the present study was to identify brain regions associated with vigilance in untreated and modafinil-treated narcoleptic patients by means of low-resolution brain electromagnetic tomography (LORETA). 16 drug-free narcoleptics and 16 normal controls were included in the baseline investigation. Subsequently patients participated in a double-blind, placebo-controlled crossover study receiving a three-week fixed titration of modafinil (200, 300, 400 mg) and placebo. Measurements comprised LORETA, the Multiple Sleep Latency Test (MSLT) and the Epworth Sleepiness Scale (ESS) obtained before and after three weeks' therapy. Statistical overall analysis by means of the omnibus significance test demonstrated significant inter-group differences in the resting (R-EEG), but not in the vigilance-controlled recordings (V-EEG). Subsequent univariate analysis revealed a decrease in alpha-2 and beta 1-3 power in prefrontal, temporal and parietal cortices, with the right hemisphere slightly more involved in this vigilance decrement. Modafinil 400 mg/d as compared with placebo induced changes opposite to the aforementioned baseline differences (key-lock principle) with a preponderance in the left hemisphere. This increase in vigilance resulted in an improvement in the MSLT and the ESS. LORETA provided evidence of a functional deterioration of the fronto-temporo-parietal network of the right-hemispheric vigilance system in narcolepsy and a therapeutic effect of modafinil on the left hemisphere, which is less affected by the disease.Adult Arousal / drug effects* Benzhydryl Compounds / pharmacology Benzhydryl Compounds / therapeutic use* Brain Mapping Double-Blind Method Drug Administration Schedule Electroencephalography / drug effects* Electromagnetic Phenomena / methods* Female Functional Laterality Humans Magnetic Resonance Imaging / methods Male Middle Aged Modafinil Narcolepsy / drug therapy* Narcolepsy / physiopathology Neuroprotective Agents / pharmacology Neuroprotective Agents / therapeutic use* Placebos Polysomnography / methods",2004 Nov
Narcolepsy,Inhibitor,"The mechanism of action of modafinil is not specified in the article. However, it is known to act as a wakefulness-promoting agent and is believed to work by increasing the release of dopamine and other neurotransmitters in the brain. The article does not mention any receptor subtypes being evaluated.",modafinil,Modafinil ameliorates excessive daytime sleepiness after traumatic brain injury.,https://pubmed.ncbi.nlm.nih.gov/21079179/,"Kaiser PR, Valko PO, Werth E, Thomann J, Meier J, Stocker R, Bassetti CL, Baumann CR.",21079179,"Excessive daytime sleepiness (EDS) and fatigue are common symptoms after traumatic brain injury (TBI), but there is no specific treatment for affected patients. With this pilot study, we aimed at studying the effect of daily modafinil on posttraumatic EDS and fatigue.
We conducted a prospective, double-blind, randomized, placebo-controlled pilot study in 20 patients with TBI who had fatigue or EDS or both. After baseline examinations (questionnaires including the Epworth Sleepiness Scale to assess EDS and the Fatigue Severity Scale to assess fatigue, actigraphy, polysomnography, maintenance of wakefulness test, and psychomotor vigilance test), 10 patients received 100 to 200 mg modafinil every morning, and 10 patients were treated with placebo. After a 6-week treatment period, all examinations were repeated.
EDS improved significantly in patients with TBI who were treated with modafinil, compared with the placebo group. Similarly, the ability to stay awake on the maintenance of wakefulness test improved only in the modafinil group. Modafinil, however, had no impact on posttraumatic fatigue. Clinically relevant side effects were not observed.
This study indicates that modafinil is effective and well tolerated in the treatment of posttraumatic EDS but not of fatigue.
This study provides Class I evidence that modafinil (100-200 mg daily) improves posttraumatic EDS compared with placebo. This study provides Class I evidence that modafinil (100-200 mg daily) does not improve posttraumatic fatigue compared with placebo.Adult Aged Benzhydryl Compounds / adverse effects Benzhydryl Compounds / therapeutic use* Brain Injuries / complications* Brain Injuries / drug therapy Disorders of Excessive Somnolence / drug therapy* Disorders of Excessive Somnolence / etiology Double-Blind Method Fatigue / drug therapy Fatigue / etiology Female Humans Male Middle Aged Modafinil Narcolepsy / drug therapy Narcolepsy / etiology Pilot Projects Placebos Prospective Studies Sleep Apnea Syndromes / drug therapy Sleep Apnea Syndromes / etiology Sleep Disorders, Circadian Rhythm / drug therapy Sleep Disorders, Circadian Rhythm / etiology Sleep Stages / drug effects* Sleep Stages / physiology",2010 Nov 16
Narcolepsy,Inhibitor,"The article does not mention any drugs being evaluated, therefore there is no information about the mechanism of action or receptor subtype.",modafinil,HLA DQB1*0602 is associated with cataplexy in 509 narcoleptic patients.,https://pubmed.ncbi.nlm.nih.gov/9456467/,"Mignot E, Hayduk R, Black J, Grumet FC, Guilleminault C.",9456467,"Narcolepsy is a sleep disorder associated with HLA DR15 (DR2) and DQB1*0602. We HLA typed 509 patients enrolled in a clinical trial for the drug modafinil and analyzed the results in relation to cataplexy, a symptom of narcolepsy characterized by muscle weakness triggered by emotions. The patients were either subjects with cataplexy who had a mean sleep latency (SL) of less than 8 minutes and two or more sleep onset rapid eye movement (REM) periods (SOREMPs) during a multiple sleep latency test, or narcoleptic patients without cataplexy but with a mean SL shorter than 5 minutes and two or more SOREMPs. The respective values of DRB1*15 (DR2) and DQB1*0602 as markers for narcolepsy were first compared in different ethnic groups and in patients with and without cataplexy. DQB1*0602 was found to be a more sensitive marker for narcolepsy than DRB1*15 across all ethnic groups. DQB1*0602 frequency was strikingly higher in patients with cataplexy versus patients without cataplexy (76.1% in 421 patients versus 40.9% in 88 patients). Positivity was highest in patients with severe cataplexy (94.8%) and progressively decreased to 54.2% in patients with the mildest cataplexy. A voluntary 50-item questionnaire focusing on cataplexy was also analyzed in 212 of the 509 HLA-typed patients. Subjects with definite cataplexy as observed by an experienced clinician were more frequently HLA DQB1*0602-positive than those with doubtful cataplexy, and the manifestations of cataplexy were clinically more typical in DQB1*0602-positive patients. These results show that the HLA association is as tight as previously reported (85-95%) when cataplexy is clinically typical or severe. We also found that patients with mild, atypical, or no cataplexy have a significantly increased DQB1*0602 frequency (40-60%) in comparison with ethnically matched controls (24%). These results could be explained by increased disease heterogeneity in the noncataplexy group or by a direct effect of the HLA DQB1*0602 genotype on the clinical expression of narcolepsy.Adolescent Adult Aged Benzhydryl Compounds / therapeutic use Cataplexy / drug therapy Cataplexy / etiology Cataplexy / immunology* Central Nervous System Stimulants / therapeutic use Female HLA-DQ Antigens / immunology* Haplotypes / genetics Humans Male Middle Aged Modafinil Narcolepsy / complications Narcolepsy / immunology* Racial Groups Severity of Illness Index Sleep, REM / physiology",1997 Nov
Narcolepsy,Inhibitor,"The mechanism of action of sodium oxybate is not specified in the abstract. However, it is mentioned that it is approved for cataplexy and excessive daytime sleepiness in narcolepsy.",sodium oxybate,"A 2-week, polysomnographic, safety study of sodium oxybate in obstructive sleep apnea syndrome.",https://pubmed.ncbi.nlm.nih.gov/20082240/,"George CF, Feldman N, Zheng Y, Steininger TL, Grzeschik SM, Lai C, Inhaber N.",20082240,"Sodium oxybate (SXB) is approved for cataplexy and excessive daytime sleepiness in narcolepsy. Obstructive sleep apnea syndrome (OSAS) affects ∼9-50% of narcoleptics. Effects of 2-week SXB administration on apnea-hypopnea index (AHI), oxygen saturation (SaO(2)), and sleep architecture were investigated in OSAS patients.
OSAS patients (n = 48) received 2-week SXB or placebo (PBO) treatment with polysomnography at baseline and day 14. The primary outcome measure was change from baseline in mean AHI. Secondary outcomes included changes from baseline in SaO(2), and sleep architecture.
Compared with PBO, SXB significantly increased reduction in mean AHI and obstructive apnea index with SXB (-0.8 ± 13.3 vs. -8.2 ± 10.0; p = 0.0327 and 3.54 ± 11.1 vs. -4.72 ± 7.7; p = 0.0054, respectively) and significantly increased change in slow wave sleep duration (5.2 ± 25.0 min vs. 29.4 ± 37.0 min; p = 0.0038). There were no differences between treatments in SaO2, central apneic events, or other measures. Adverse events, most commonly headache, were noted in nine of 27 (33%) and six of 23 (26%) patients receiving SXB and PBO, respectively.
Short-term use of 4.5 g/night SXB did not generate respiratory depressant effects in OSAS patients as measured by AHI, obstructive apnea events, central apneas, and SaO2. Extended use of SXB in higher therapeutic doses in OSAS has not been studied, and merits caution.Adjuvants, Anesthesia / adverse effects Adjuvants, Anesthesia / therapeutic use* Adult Benzhydryl Compounds / adverse effects Benzhydryl Compounds / therapeutic use Central Nervous System Stimulants / adverse effects Central Nervous System Stimulants / therapeutic use Combined Modality Therapy Continuous Positive Airway Pressure Disorders of Excessive Somnolence / drug therapy Drug Therapy, Combination Female Humans Hypnotics and Sedatives / adverse effects Hypnotics and Sedatives / therapeutic use Male Middle Aged Modafinil Polysomnography / drug effects* Pyridines / adverse effects Pyridines / therapeutic use Sleep Apnea, Obstructive / drug therapy* Sodium Oxybate / adverse effects Sodium Oxybate / therapeutic use* Zolpidem",2011 Jan
Narcolepsy,Inhibitor,The mechanism of action of modafinil is not specified in the article.,modafinil,"Efficacy and safety of modafinil in patients with idiopathic hypersomnia without long sleep time: a multicenter, randomized, double-blind, placebo-controlled, parallel-group comparison study.",https://pubmed.ncbi.nlm.nih.gov/33631500/,"Inoue Y, Tabata T, Tsukimori N.",33631500,"Few treatments are available for patients with idiopathic hypersomnia (IH). Modafinil, an established treatment for narcolepsy, was tested for efficacy and safety in Japanese patients with IH without long sleep time.
This multicenter, randomized, double-blind, placebo-controlled, parallel-group comparison study was conducted at 20 institutions in Japan. Patients who met the diagnostic criteria of IH in the International Classification of Sleep Disorders (second edition) were included. The study comprised a ≥17-day observation period and a 3-week treatment period during which modafinil (200 mg) or placebo was administered orally once daily (in the morning). The primary efficacy endpoint was change in mean sleep latency on the Maintenance of Wakefulness Test (MWT). Adverse events (AEs) were also recorded to evaluate safety.
In total, 123 patients were screened and 71 were randomized to receive modafinil (N = 34) or placebo (N = 37). Patients treated with modafinil experienced a significantly prolonged mean sleep latency on the MWT at the end of the study compared with placebo (5.02 min, 95% confidence interval: 3.26-6.77 min; p < 0.001). AEs occurred in 58.8% (20/34) and 27.0% (10/37) of patients in the modafinil and placebo groups, respectively. Frequent AEs in the modafinil group were headache (n = 6), dry mouth (n = 3), and nausea (n = 3); no clinically significant AEs occurred.
Modafinil was shown to be an effective and safe treatment for excessive daytime sleepiness in patients with IH without long sleep time.
JapicCTI; 142539.Benzhydryl Compounds / adverse effects Central Nervous System Stimulants* / therapeutic use Disorders of Excessive Somnolence* / drug therapy Double-Blind Method Humans Idiopathic Hypersomnia* / drug therapy Japan Modafinil / therapeutic use Sleep Treatment Outcome Wakefulness",2021 Apr
Narcolepsy,Inhibitor,None,modafinil,Modafinil reduces patient-reported tiredness after sedation/analgesia but does not improve patient psychomotor skills.,https://pubmed.ncbi.nlm.nih.gov/19719817/,"Galvin E, Boesjes H, Hol J, Ubben JF, Klein J, Verbrugge SJ.",19719817,"Early recovery of patients following sedation/analgesia and anesthesia is important in ambulatory practice. The aim of this study was to assess whether modafinil, used for the treatment of narcolepsy, improves recovery following sedation/analgesia.
Patients scheduled for extracorporeal shock wave lithotripsy were randomly assigned to one of four groups. Two groups received a combination of fentanyl/midazolam with either modafinil or placebo. The remaining groups received remifentanil/propofol with either modafinil or placebo. Modafinil 200 mg was administered to the treatment group patients 1 h before sedation/analgesia. Groups were compared using the digital symbol substitution test (DSST), trail making test (TMT), observer scale of sedation and analgesia (OAA/S) and Aldrete score. Verbal rating scale (VRS) scores for secondary outcome variables e.g. energy, tiredness and dizziness were also recorded before and after treatment.
Sixty-seven patients successfully completed the study. Groups received similar doses of sedation and analgesic drugs. No statistically significant difference was found for DSST between groups. No significant adverse effects occurred in relation to modafinil. No statistically significant difference between groups was identified for TMT, OAA/S and Aldrete scores. The mean VRS score for tiredness was lesser in the modafinil/fentanyl/midazolam group [1.3 (2.0)] compared with the placebo group [3.8 (2.5)], P=0.02. Such a difference was not found between the remifentanil/propofol groups [placebo 2.6 (2.2) vs. modafinil 3.1(2.7)], p>0.05. Dizziness was greater in the modafinil/remifentanil/propofol group 1.7 (2.0) vs. placebo 0.0 (0.5), p<0.05.
Modafinil reduces patient-reported tiredness after sedation/analgesia but does not improve recovery in terms of objective measures of patient psychomotor skills.Adolescent Adult Aged Aged, 80 and over Analgesia Anesthesia Recovery Period Anesthetics, Inhalation / administration & dosage Appetite / drug effects Benzhydryl Compounds / therapeutic use* Central Nervous System Stimulants / therapeutic use* Deep Sedation Dizziness / prevention & control Fatigue / prevention & control* Fentanyl / administration & dosage Humans Lithotripsy Midazolam / administration & dosage Middle Aged Modafinil Nausea / prevention & control Neuropsychological Tests Pain / prevention & control Piperidines / administration & dosage Placebos Propofol / administration & dosage Psychomotor Agitation / prevention & control Psychomotor Performance / drug effects* Relaxation Remifentanil Sleep Stages / drug effects Young Adult",2010 Feb
Narcolepsy,Inhibitor,"The mechanism of action of the drug modafinil is not specified in the abstract. However, it is classified as a central nervous system stimulant. There is no mention of a specific receptor subtype being targeted.",modafinil,Effects of modafinil on cognitive and meta-cognitive performance.,https://pubmed.ncbi.nlm.nih.gov/15252824/,"Baranski JV, Pigeau R, Dinich P, Jacobs I.",15252824,"The stimulant modafinil has proved to be an effective treatment modality for narcolepsy and related sleep disorders and is also being studied for use during sustained military operations to ameliorate the effects of fatigue due to sleep loss. However, a previous study reported that a relatively large, single dose of modafinil (300 mg), administered to already sleep-deprived individuals, caused participants to overestimate their cognitive abilities (i.e. 'overconfidence'). Because the predominant application of modafinil is in otherwise healthy, non-sleep-deprived individuals, the present study investigated the generality of modafinil-induced overconfidence in a group of 18 healthy, non sleep-deprived adults. The design involved a double-blind, placebo controlled, fully within-subjects manipulation of placebo and modafinil (4 mg/kg: approximately 300 mg, on average) over three 50-min cognitive testing sessions (i.e. before drug ingestion, and at 90 and 180 min after drug ingestion). The cognitive task battery included subjective assessments of mood, fatigue, affect, vigor and motivation, and cognitive assessments of serial reaction time, logical reasoning, visual comparison, mental addition and vigilance. In addition, trial-by-trial confidence judgements were obtained for two of the cognitive tasks and more global, task level assessments of performance were obtained for four of the cognitive tasks. Relative to placebo, modafinil improved fatigue levels, motivation, reaction time and vigilance. In terms of self-assessments of cognitive performance, both the placebo and modafinil conditions were 'well calibrated' on trial-by-trial confidence judgements, showing neither marked over- nor under-confidence. Of note, the modafinil condition displayed a non-significant tendency towards 'overconfidence' for task-level assessments of performance. The present findings highlight the need for continued research on the many complex interactions involving fatigue states, occasional versus long-term stimulant use, and subjective assessments of fatigue and cognitive performance.Adolescent Adult Benzhydryl Compounds / pharmacology* Central Nervous System Stimulants / pharmacology* Cognition / drug effects* Double-Blind Method Fatigue / psychology Humans Male Modafinil Reaction Time / drug effects Surveys and Questionnaires Visual Perception / drug effects",2004 Jul
Narcolepsy,Inhibitor,"The mechanism of action of modafinil is not specified in the abstract, but it is noted that it is a central nervous system stimulant. The article does not mention any specific receptor subtype that the drug is being evaluated with.",modafinil,"A randomized, double-blind, crossover trial of modafinil on mood.",https://pubmed.ncbi.nlm.nih.gov/17224718/,"Taneja I, Haman K, Shelton RC, Robertson D.",17224718,"Modafinil, a medication for the excessive sleepiness associated with narcolepsy, has been hypothesized to improve not just alertness but mood as well. The purpose of this study was to determine how treatment with modafinil affects mood in healthy volunteers. Normal healthy volunteers (n = 12, 10 men and 2 women; 30-44 years) underwent a 3-day, counterbalanced, randomized, crossover, inpatient trial of modafinil (400 mg daily) versus placebo with 4-day washout period between 2 treatments. Mood was assessed daily using both the Positive and Negative Affect Schedule and a general mood scale, which consisted of 10 bipolar adjective ratings based on a severity scale ranging from 1 to 10. Modafinil increased general mood and Negative Affect scales relative to placebo and had a significant effect on Positive Affect scales. These results suggest that modafinil may have general mood-elevating effects accompanied by increased negative affect (anxiety). The findings may have implications for clinical practice, in particular for the adjunctive use of modafinil in treatment-resistant depression.Administration, Oral Adult Affect / drug effects* Benzhydryl Compounds / administration & dosage Benzhydryl Compounds / pharmacology* Central Nervous System Stimulants / administration & dosage Central Nervous System Stimulants / pharmacology* Cross-Over Studies Double-Blind Method Female Hospitalization Humans Male Modafinil Reference Values",2007 Feb
