Indicator,MoA Type ,MoA,Drug,Title,URL,Author,PMID,Abstract,Date
Narcolepsy,Inhibitor,The mechanism of action of solriamfetol is as a dopamine/norepinephrine reuptake inhibitor. It does not have a specific receptor subtype that it targets.,solriamfetol,Effects of solriamfetol in a long-term trial of participants with obstructive sleep apnea who are adherent or nonadherent to airway therapy.,https://pubmed.ncbi.nlm.nih.gov/33179591/,"Schweitzer PK, Strohl KP, Mayer G, Rosenberg R, Chandler P, Baladi M, Lee L, Malhotra A.",33179591,"Solriamfetol, a dopamine/norepinephrine reuptake inhibitor, is approved in the United States and European Union to treat excessive daytime sleepiness in patients with obstructive sleep apnea (OSA) (37.5-150 mg/day) and narcolepsy (75-150 mg/day). This analysis evaluated solriamfetol's efficacy in subgroups of participants with OSA who were adherent or nonadherent to primary OSA therapy at baseline and examined whether solriamfetol affected the use of primary therapy in an open-label extension trial.
Participants with OSA who completed prior solriamfetol studies received solriamfetol 75, 150, or 300 mg/day for ≤ 52 weeks. The main efficacy outcome was the Epworth Sleepiness Scale score. Primary therapy use was summarized as the percentage of nights, the number of hours/night, and the percentage of nights with use ≥ 50%/night (%). Efficacy and primary therapy use are reported for participants who directly enrolled from a previous 12-week study and had ≤ 40 weeks of open-label treatment (n = 333). Safety data are reported for all participants (n = 417).
Mean ESS scores in adherent (n = 255) and nonadherent (n = 78) subgroups, respectively, were 15.0 and 15.8 at baseline (of 12-week study) and 6.5 and 6.8 at week 40. For participants using an airway therapy, mean use at baseline was 90% of nights, 6.6 hours/night, and use ≥ 50%/night on 90% of nights; changes from baseline to week 40 were minimal (0.9%, -0.8 hours, and 6.5%, respectively). Common adverse events (both subgroups) included headache, nasopharyngitis, insomnia, dry mouth, nausea, anxiety, and upper respiratory tract infection.
Long-term efficacy and safety of solriamfetol were similar regardless of adherence to primary OSA therapy. Solriamfetol did not affect primary therapy use.
Registry: ClinicalTrials.gov; Name: A Long-Term Safety Study of JZP-110 in the Treatment of Excessive Sleepiness in Subjects with Narcolepsy or OSA; URL: https://clinicaltrials.gov/ct2/show/NCT02348632; Identifier: NCT02348632 and Registry: EU Clinical Trials Register; Identifier: 2014-005489-31; URL: https://www.clinicaltrialsregister.eu/ctr-search/search?query=2014-005489-31..Carbamates Continuous Positive Airway Pressure Disorders of Excessive Somnolence* Humans Phenylalanine / analogs & derivatives Sleep Apnea, Obstructive* Treatment Outcome",2021 Apr 1
Narcolepsy,Inhibitor,The mechanism of action of solriamfetol is dopamine and norepinephrine reuptake inhibition. There is no specific receptor subtype mentioned in the article.,solriamfetol,"A Randomized, Double-Blind, Placebo- and Positive-Controlled, 4-Period Crossover Study of the Effects of Solriamfetol on QTcF Intervals in Healthy Participants.",https://pubmed.ncbi.nlm.nih.gov/32935460/,"Zomorodi K, Chen D, Lee L, Swearingen D, Carter LP.",32935460,"Solriamfetol, a dopamine and norepinephrine reuptake inhibitor, is approved (United States and European Union; Sunosi) to treat excessive daytime sleepiness associated with narcolepsy (75-150 mg/day) or obstructive sleep apnea (37.5-150 mg/day). A thorough QT/QTc study assessed solriamfetol effects on QT interval (Fridericia correction for heart rate; QTcF). This randomized, double-blind, placebo- and positive-controlled, 4-period crossover study compared single doses of 300 and 900 mg solriamfetol, 400 mg moxifloxacin, and placebo in healthy adults. Placebo- and predose-adjusted mean differences in QTcF (ddQTcF; primary end point) were analyzed, and solriamfetol pharmacokinetics were characterized. Fifty-five participants completed all periods. Upper bounds of 2-sided 90% confidence intervals (CIs) for ddQTcF for both solriamfetol doses were <10 milliseconds at all postdose time points. Assay sensitivity was demonstrated with moxifloxacin; lower bounds of 2-sided 90%CIs for ddQTcF > 5 milliseconds at 1, 2, and 3 hours postdose. There were no QTcF increases > 60 milliseconds or QTcF values > 480 milliseconds at either solriamfetol dose. Solriamfetol median tAdrenergic Uptake Inhibitors / administration & dosage Adrenergic Uptake Inhibitors / adverse effects Adrenergic Uptake Inhibitors / pharmacokinetics Adult Carbamates / administration & dosage Carbamates / adverse effects* Carbamates / pharmacokinetics Cross-Over Studies Dopamine Uptake Inhibitors / administration & dosage Dopamine Uptake Inhibitors / adverse effects Dopamine Uptake Inhibitors / pharmacokinetics Dose-Response Relationship, Drug Double-Blind Method Electrocardiography* Female Humans Long QT Syndrome / chemically induced* Male Middle Aged Moxifloxacin / adverse effects Phenylalanine / administration & dosage Phenylalanine / adverse effects Phenylalanine / analogs & derivatives* Phenylalanine / pharmacokinetics Young Adult",2021 Apr
Narcolepsy,Inhibitor,"The mechanism of action is selective dopamine and norepinephrine reuptake inhibition, and the drug being evaluated is Solriamfetol (JZP-110). There is no mention of specific receptor subtypes in the article.",solriamfetol,"A Phase I, Randomized, Crossover, Open-label Study of the Pharmacokinetics of Solriamfetol (JZP-110) in Healthy Adult Subjects With and Without Food.",https://pubmed.ncbi.nlm.nih.gov/30598342/,"Zomorodi K, Kankam M, Lu Y.",30598342,"Solriamfetol (JZP-110), a selective dopamine and norepinephrine reuptake inhibitor with robust wake-promoting effects, is currently being evaluated for the reduction of sleepiness and improvement of wakefulness in patients with narcolepsy and obstructive sleep apnea. The purpose of this study was to evaluate the effect of food on the pharmacokinetic (PK) parameters and bioavailability of solriamfetol at the highest intended therapeutic dose in healthy adults and to characterize its renal excretion under fasting conditions.
In this open-label, randomized, crossover study, healthy adult subjects received a single 300-mg dose of solriamfetol in a fasted condition (10 h) and in a fed condition (30 min after the start of a standardized high-fat, high-calorie breakfast), with at least a 7-day washout period between doses. Blood samples for PK analyses were collected during both conditions at prespecified time points. Urine samples were collected up to 48 h postdose in the fasted condition. Samples were analyzed for solriamfetol (plasma and urine) and N-acetyl solriamfetol (urine) by using validated LC-MS/MS bioanalytical methods. The effect of food on solriamfetol relative bioavailability was examined by comparing the 90% confidence intervals (CIs) of the fed/fasted ratios of natural log-transformed PK parameters C
A total of 32 subjects were enrolled (50% female; 53.1% black, 46.9% white; mean age, 35.6 years), and 31 were included in the PK analyses. Solriamfetol was rapidly absorbed in both conditions. The 90% CIs for the fed/fasted geometric mean ratios were 89.2-98.8 for C
Solriamfetol relative bioavailability was bioequivalent in the fed and fasted conditions, showing that solriamfetol can be taken without regard to meals; furthermore, tolerability was similar in both conditions. Renal excretion of unchanged drug is the primary route of elimination.Adult Area Under Curve Biological Availability Carbamates / pharmacokinetics* Cross-Over Studies Fasting / metabolism* Female Food-Drug Interactions* Healthy Volunteers Humans Male Middle Aged Phenylalanine / analogs & derivatives* Phenylalanine / pharmacokinetics Therapeutic Equivalency",2019 Feb
Narcolepsy,Inhibitor,The article does not provide information on the mechanism of action or receptor subtype of the antidepressants being evaluated.,antidepressants,Exacerbation of cataplexy following gradual withdrawal of antidepressants: manifestation of probable protracted rebound cataplexy.,https://pubmed.ncbi.nlm.nih.gov/18753005/,"Ristanovic RK, Liang H, Hornfeldt CS, Lai C.",18753005,"A double-blind, placebo-controlled sodium oxybate trial provided a unique opportunity to compare changes in cataplexy following gradual withdrawal from antidepressants in narcolepsy patients.
Of 228 enrolled patients, 71 discontinued antidepressant therapy. Data from 57 patients were available for analysis: 37 patients discontinued tricyclic antidepressants (TCAs) and 20 discontinued selective serotonin reuptake inhibitors (SSRIs). The trial included a 21-day withdrawal phase followed by 18-day washout and 14-day single-blind treatment phases. Two additional weeks were permitted for withdrawal from fluoxetine due to its long half-life. Weekly cataplexy attacks were recorded throughout the trial. No historical data on the frequency of cataplexy prior to treatment with antidepressants was available.
Among the patients who were and were not withdrawn from antidepressants treatment, the median frequency of baseline weekly cataplexy was similar (17.5 vs. 14.0, respectively). As expected, significant between-group differences emerged by the end of the washout period (52.04 vs. 15.25, respectively; p<0.05); however, the frequency of cataplexy events became similar again by the end of the trial (16.5 vs. 17.5, respectively).
Patients gradually withdrawn from antidepressants experienced a significant increase in cataplexy, but eventually returned to their baseline frequency, comparable to previously untreated control patients. Compared to SSRIs, discontinuation from TCAs was associated with a greater increase in cataplexy attacks.Adult Antidepressive Agents, Tricyclic / administration & dosage Antidepressive Agents, Tricyclic / adverse effects* Cataplexy / chemically induced* Cataplexy / diagnosis Cataplexy / epidemiology* Cohort Studies Dose-Response Relationship, Drug Humans Narcolepsy / drug therapy Retrospective Studies Risk Factors Selective Serotonin Reuptake Inhibitors / administration & dosage Selective Serotonin Reuptake Inhibitors / adverse effects* Sodium Oxybate / therapeutic use Substance Withdrawal Syndrome / diagnosis Substance Withdrawal Syndrome / epidemiology*",2009 Apr
Narcolepsy,Inhibitor,The article does not mention any specific drugs being evaluated. It discusses the levels of hypocretin-1 in control and depressed subjects and the effect of sertraline and bupropion on these levels.,cerebrospinal fluid hypocretin-1,Diurnal variation of cerebrospinal fluid hypocretin-1 (Orexin-A) levels in control and depressed subjects.,https://pubmed.ncbi.nlm.nih.gov/12873798/,"Salomon RM, Ripley B, Kennedy JS, Johnson B, Schmidt D, Zeitzer JM, Nishino S, Mignot E.",12873798,"Hypocretins, excitatory neuropeptides at monoaminergic synapses, appear to regulate human sleep-wake cycles. Undetectable cerebrospinal fluid hypocretin-1 levels are seen in narcolepsy, which is frequently associated with secondary depression. Shortened rapid eye movement latency is observed in both narcolepsy and depression. Cerebrospinal fluid hypocretin-1 levels have not been reported in mood disorders.
We examined hypocretin-1 levels in 14 control and 15 depressed subjects. Cerebrospinal fluid was drawn continuously in supine subjects for 24 hours with an indwelling intrathecal catheter under entrained light-dark conditions. Depressed subjects were studied before and after 5 weeks of sertraline (n=10, three nonresponders) or bupropion (n=5, two nonresponders).
Hypocretin-1 levels varied slightly (amplitude 10%) but significantly across the diurnal cycle in control subjects, with amplitude significantly reduced in depression (3%). Levels were lowest at midday, surprising for a hypothetically wake-promoting peptide. Mean hypocretin levels trended higher in depressive than in control subjects. Hypocretin-1 levels decreased modestly but significantly after sertraline (-14%) but not bupropion.
Our results are consistent with previous physiologic findings in depression indicating dampened diurnal variations in hypocretin-1. The finding that sertraline but not bupropion slightly decreased cerebrospinal fluid hypocretin-1 indicates a serotoninergic influence on hypocretin tone.Adult Antidepressive Agents / therapeutic use Antidepressive Agents, Second-Generation / therapeutic use Bupropion / therapeutic use Carrier Proteins / cerebrospinal fluid* Carrier Proteins / drug effects Case-Control Studies Circadian Rhythm* / drug effects Depressive Disorder / cerebrospinal fluid* Depressive Disorder / drug therapy* Dopamine Uptake Inhibitors / therapeutic use Female Humans Intracellular Signaling Peptides and Proteins* Male Neuropeptides / cerebrospinal fluid* Neuropeptides / drug effects Orexins Radioimmunoassay Selective Serotonin Reuptake Inhibitors / therapeutic use Sertraline / therapeutic use",2003 Jul 15
Narcolepsy,Inhibitor,"The mechanism of action of the drug modafinil is not specifically mentioned in the abstract, but it is described as a central nervous system stimulant. The article does not mention any receptor subtype(s) that the drug is being evaluated with.",modafinil,Modafinil-induced hippocampal activation in narcolepsy.,https://pubmed.ncbi.nlm.nih.gov/17600622/,"Kim YK, Yoon IY, Shin YK, Cho SS, Kim SE.",17600622,"This study was undertaken to investigate regional metabolic abnormalities and to determine the effects of modafinil in narcoleptics on cerebral glucose metabolism using [(18)F] fluorodeoxyglucose positron emission tomography (FDG PET). Eight narcoleptic patients participated in the study. Two [(18)F] FDG PET scans were obtained before and after 2 weeks of modafinil treatment. To identify the effect of modafinil on regional cerebral abnormalities in narcoleptics, pre- and post-treatment PET scans were compared using paired t-statistics with voxel-wised manner. In narcolepsy patients, significant decreases in cerebral glucose metabolism were observed in the midbrain and upper pons, bilateral hypothalamus, posterior thalamus, hippocampus and right parahippocampus as compared with healthy subjects. After treatment, a significant increase in glucose metabolism in the left hippocampus was found in comparison with pre-treatment scan. This study demonstrated that modafinil activates the hippocampus which receives the afferents from hypothalamus, the center of sleep-wake rhythm.Adolescent Adult Benzhydryl Compounds / pharmacology* Benzhydryl Compounds / therapeutic use Brain Mapping Brain Stem / diagnostic imaging Brain Stem / drug effects Brain Stem / metabolism Central Nervous System Stimulants / pharmacology* Central Nervous System Stimulants / therapeutic use Energy Metabolism / drug effects Female Fluorodeoxyglucose F18 Functional Laterality / drug effects Glucose / metabolism Hippocampus / diagnostic imaging Hippocampus / drug effects* Hippocampus / metabolism* Humans Hypothalamus / diagnostic imaging Hypothalamus / drug effects Hypothalamus / metabolism Male Modafinil Narcolepsy / diagnostic imaging Narcolepsy / drug therapy* Narcolepsy / physiopathology* Neural Pathways / diagnostic imaging Neural Pathways / drug effects Neural Pathways / metabolism Positron-Emission Tomography Sleep Thalamus / diagnostic imaging Thalamus / drug effects Thalamus / metabolism Treatment Outcome Wakefulness",2007 Jul 11
Narcolepsy,Inhibitor,The mechanism of action for sodium oxybate is not provided in the abstract. The article does not mention any specific receptor subtypes that the drug is being evaluated with.,sodium oxybate,Sodium oxybate treatment in narcolepsy and its effect on muscle tone.,https://pubmed.ncbi.nlm.nih.gov/28619175/,"Mayer G, Rodenbeck A, Kesper K; International Xyrem Study Group.",28619175,"To estimate the effect of the compound sodium oxybate (SO) on chin muscle tone in sleep, a re-analysis of the results of the international multicenter study SXB-15 was performed, applying a validated semi-automatic analysis of muscle tone. This analysis distinguishes short (<0.5 s) and long (>0.5 s) muscle activity indices per hour (SMI, LMI) in 116 patients with narcolepsy-cataplexy. While stable stimulant medication was permitted, tricyclics and SSRIs were withdrawn. Polysomnographies were performed at baseline (V5), four weeks after titration of SO to 4.5 g, 6 g, or 9 g or placebo (V6) and after another four weeks on stable SO dose (V7).
SMI and LMI decreased significantly during light sleep. LMI remained stable in all SO groups during slow wave sleep (SWS), but decreased significantly during REM sleep. SMI decreased non-significantly, but consistently during SWS and REM in the 9 g group only. A subgroup analysis of patients who stayed on stimulants showed that they had higher SMIs and LMIs in all groups. Patients who had been treated with anticataplectic medication prior to study inclusion had lower LMIs in the 9 g group during REM sleep in all visits.
SO has a differential effect on muscle tone that is dose and sleep stage dependent. Low dosages increase short muscle activity, possibly enabling the occurrence of parasomnias. High doses are especially efficacious in REM sleep, suggesting that SO could be used to treat REM sleep behavior disorder. Comedication with stimulants and prior medication with anticataplectic medication exerts an influence on muscle tone.Adult Central Nervous System Stimulants / therapeutic use Dose-Response Relationship, Drug Double-Blind Method Female Humans Male Movement / drug effects Movement / physiology Multivariate Analysis Muscle Tonus / drug effects* Muscle, Skeletal / drug effects Muscle, Skeletal / physiopathology Narcolepsy / drug therapy* Narcolepsy / physiopathology Polysomnography Sleep Aids, Pharmaceutical / therapeutic use* Sleep Stages / drug effects Sleep Stages / physiology Sodium Oxybate / therapeutic use*",2017 Jul
Narcolepsy,Inhibitor,"There is no mention of any drugs being evaluated in this article. It discusses the discovery of hypocretins and their involvement in narcolepsy and primary hypersomnia, as well as the results of a study measuring cerebrospinal fluid concentrations of hypocretin-1 and hypocretin-2.",hypocretin,Hypocretin (orexin) deficiency in narcolepsy and primary hypersomnia.,https://pubmed.ncbi.nlm.nih.gov/12486284/,"Ebrahim IO, Sharief MK, de Lacy S, Semra YK, Howard RS, Kopelman MD, Williams AJ.",12486284,"The discovery that hypocretins are involved in narcolepsy, a disorder associated with excessive daytime sleepiness, cataplexy, and unusually rapid transitions to rapid eye movement sleep, opens a new field of investigation in the area of disorders of sleep and activation. Hypocretin-1 (hcrt-1) and hypocretin-2 (hcrt-2) (also called orexin-A and orexin-B) are newly discovered neuropeptides processed from a common precursor. Hypocretin containing cells are located exclusively in the lateral hypothalamus, with widespread projections within the central nervous system. The role of the hypocretin system in other disorders causing excessive daytime sleepiness is more uncertain. This study reports the findings of a prospective study measuring cerebrospinal fluid concentrations of hypocretin-1 and hypocretin-2 in HLA DQB1*0602 positive narcolepsy with cataplexy, monosymptomatic narcolepsy, and primary hypersomnia. The results confirmed the previous observations, that hcrt-1 is deficient in narcolepsy and for the first time report very low levels of hcrt-1 in primary hypersomnia. It is also reported for the first time that there is a generalised defect in hcrt-2 transmission in all three of these clinical entities compared with controls.Adult Aged Carrier Proteins / cerebrospinal fluid* Cataplexy / cerebrospinal fluid* Cataplexy / immunology Disorders of Excessive Somnolence / cerebrospinal fluid* Disorders of Excessive Somnolence / immunology Female HLA-DQ Antigens / analysis HLA-DQ beta-Chains Humans Intracellular Signaling Peptides and Proteins* Male Middle Aged Narcolepsy / cerebrospinal fluid* Narcolepsy / immunology Neuropeptides / cerebrospinal fluid* Neuropeptides / deficiency* Orexins Predictive Value of Tests Prospective Studies Reference Values",2003 Jan
Narcolepsy,Inhibitor,The article does not mention any specific drugs or their mechanisms of action.,carbamazepine,Secondary narcolepsy may be a causative factor of increased daytime sleepiness in obese childhood craniopharyngioma patients.,https://pubmed.ncbi.nlm.nih.gov/16700320/,"MÃ¼ller HL, MÃ¼ller-StÃ¶ver S, Gebhardt U, Kolb R, SÃ¶rensen N, Handwerker G.",16700320,"Prognosis in childhood craniopharyngioma survivors hinges upon late effects such as pituitary deficiency and obesity. Observations indicate that reduced physical activity and increased daytime sleepiness might be risk factors for obesity. We analyzed the degree of daytime sleepiness in 115 childhood craniopharyngioma patients (47% obese) using the Epworth Sleepiness Scale (ESS). Thirty-five (30%) displayed increased daytime sleepiness (ESS score > 10) of whom 14 were obese (26% of obese cohort). Polysomnography (PSG) and Multiple Sleep Latency Tests (MSLT) were conducted with 10 obese patients presenting increased daytime sleepiness, with only two craniopharyngioma patients revealing a sleep related breathing disorder. Four patients had repeated episodes of SOREM (sleep onset rapid eye movement), the classic PSG criterion for narcolepsy. Three patients displayed hypersomnia. All but one patient qualified as acutely obese. We speculate that secondary narcolepsy is an exacerbating condition of childhood craniopharyngioma obesity, supported by recent reports on orexin and narcolepsy which suggest hypothalamic failure in idiopathic narcolepsy.Adolescent Adult Body Mass Index Central Nervous System Stimulants / therapeutic use Child Cohort Studies Craniopharyngioma / complications* Female HLA Antigens / metabolism Humans Male Narcolepsy / drug therapy Narcolepsy / etiology* Obesity / complications* Pituitary Neoplasms / complications* Polysomnography Risk Factors Sleep / physiology Sleep Stages",2006 Apr
Narcolepsy,Inhibitor,The mechanism of action of JZP-110 is dopaminergic and noradrenergic activity. The article does not mention any specific receptor subtype(s) being targeted.,JZP-110,Effect of oral JZP-110 (ADX-N05) treatment on wakefulness and sleepiness in adults with narcolepsy.,https://pubmed.ncbi.nlm.nih.gov/26298786/,"Bogan RK, Feldman N, Emsellem HA, Rosenberg R, Lu Y, Bream G, Khayrallah M, Lankford DA.",26298786,"JZP-110 is a wake-promoting agent with dopaminergic and noradrenergic activity.
This double-blind, crossover study, randomized adults with narcolepsy with or without cataplexy (N = 33) to placebo or JZP-110 at 150 mg/day (weeks 1 and 3) increased to 300 mg/day (weeks 2 and 4). Patients had to have baseline Epworth Sleepiness Scale (ESS) scores ≥10 and mean sleep latencies ≤10 min on the Maintenance of Wakefulness Test (MWT). Efficacy end points included MWT sleep latency and ESS, and the percentage of patients improved on the Clinical Global Impression of Change.
Patients were primarily male (57.6%) and white (69.7%), with a mean (standard deviation) age of 37.1 (12.4) years. At two weeks, the change in the mean MWT sleep latency was 11.8 min longer with JZP-110 than with placebo (P = 0.0002); JZP-110 resulted in greater changes in sleep latency on each MWT trial (P <0.001). For ESS, JZP-110 was more efficacious relative to placebo after 1 (P <0.0001) and two weeks (P = 0.0002); final ESS scores were 10.8 with JZP-110 and 15.2 with placebo, changes of -6.7 and -2.4, respectively. JZP-110 was generally well tolerated; the most common adverse events with JZP-110 were nausea (12%), noncardiac chest discomfort (9.1%), and headache (9.1%).
The efficacy of JZP-110 for impaired wakefulness and excessive sleepiness was observed at 150-300 mg/day and as early as one week after initiating treatment (Clinicaltrials.gov identifier NCT01485770).Administration, Oral Adult Cross-Over Studies Double-Blind Method Female Humans Male Middle Aged Narcolepsy / complications Narcolepsy / drug therapy* Narcolepsy / physiopathology Phenylalanine / analogs & derivatives* Phenylalanine / therapeutic use* Treatment Outcome Wakefulness / drug effects",2015 Sep
